### ISSUE TITLE
Most features work correctly, but Loving Songs times out

### ISSUE THREAD

**Issue by mwodrich** [PromyLOPh/pianobar#532]
Playing songs, changing stations, and banning songs for example all work just fine, but when I Love a song, this happens:

"(i) Loving song... Network error: Timeout was reached"

I recently upgraded to Ubuntu 15.04 and had to rebuild from source.  I pulled master at the time (61dbc218e747f1b550a2615ffe3065024db29239), found and installed packages until errors from not being able to find them went away, and was able to build and install successfully.

**Comment by PromyLOPh** [comment]
Works fine here. Temporary issue?

**Comment by gdudek** [comment]
Works OK for me despite that fact I am inside a deep and laggy firewall hole.

**Comment by glyndon** [comment]
This began to happen to me yesterday. Not just on 'Love' events, but also after about 10 minutes of playing a song, or when it fetches a new playlist. I also noted that if I love a song and get the timeout, it keeps playing and I can love it again and it says OK immediately. 

In my case the issue on a RasPi (plain Raspbian) using a version of pianobar that I compiled several weeks ago and had been perfectly stable till now. Makes me suspect a change in the API, or server probs at Pandora's end.

**Comment by PromyLOPh** [comment]
> It's as if the server is closing the control-channel socket (the HTTP one to tuner.pandora.com) in the absence of keepalive activity.

Actually, that might be the case since curl caches active connections. Can you check that with wireshark/tcpdump?

> a version of pianobar that I compiled several weeks ago

Can you recall the commit hash or date?

**Comment by glyndon** [comment]
I'm pretty sure it is the latest commit (from about 2-3 weeks ago?). I'm still 'git'ing up to speed learning git, so not sure how to be sure. The version shown at launch never seems to change.

I'll sniff it with tcpdump and see if I can catch that socket doing something strange. Is there anything in particular I should look for?

**Comment by PromyLOPh** [comment]
> The version shown at launch never seems to change.
Yep, the last “official release” has been almost a year ago.

> I'll sniff it with tcpdump and see if I can catch that socket doing
> something strange. Is there anything in particular I should look for?
I think we’d be looking for TCP retransmissions here. Also there
shouldn’t be any SYNs if curl is reusing the old connection.

**Comment by glyndon** [comment]
Watched the session to tuner.pandora.com:80/tcp
   tcpdump \(ip host 208.85.40.92 or ip host 208.85.40.35\) and tcp port 80

Saw normal session setup traffic (not shown here)
After playing ~10 minutes, it went to fetch a new playlist, timed out.
No new traffic on the session at this point.
I restarted playing, had to choose a station again, and it started.
Still no traffic on the session, and music is again playing.
I pressed 'e', which timed out. (at 17:04:39.003379)
Pressed it again, and got a response. (at 17:05:15.224149)

17:04:39.003379 IP osmo.46021 > tuner.pandora.com.http: Flags [P.], seq 803:1606, ack 927, win 954, options [nop,nop,TS val 53088200 ecr 105532652], length 803
17:04:39.317294 IP osmo.46021 > tuner.pandora.com.http: Flags [P.], seq 803:1606, ack 927, win 954, options [nop,nop,TS val 53088232 ecr 105532652], length 803
17:04:39.637191 IP osmo.46021 > tuner.pandora.com.http: Flags [P.], seq 803:1606, ack 927, win 954, options [nop,nop,TS val 53088264 ecr 105532652], length 803
17:04:40.277199 IP osmo.46021 > tuner.pandora.com.http: Flags [P.], seq 803:1606, ack 927, win 954, options [nop,nop,TS val 53088328 ecr 105532652], length 803
17:04:41.557227 IP osmo.46021 > tuner.pandora.com.http: Flags [P.], seq 803:1606, ack 927, win 954, options [nop,nop,TS val 53088456 ecr 105532652], length 803
17:04:44.127186 IP osmo.46021 > tuner.pandora.com.http: Flags [P.], seq 803:1606, ack 927, win 954, options [nop,nop,TS val 53088713 ecr 105532652], length 803
17:04:49.257233 IP osmo.46021 > tuner.pandora.com.http: Flags [P.], seq 803:1606, ack 927, win 954, options [nop,nop,TS val 53089226 ecr 105532652], length 803
17:04:59.517228 IP osmo.46021 > tuner.pandora.com.http: Flags [P.], seq 803:1606, ack 927, win 954, options [nop,nop,TS val 53090252 ecr 105532652], length 803
17:05:09.011243 IP osmo.46021 > tuner.pandora.com.http: Flags [F.], seq 1606, ack 927, win 954, options [nop,nop,TS val 53091201 ecr 105532652], length 0
17:05:15.224149 IP osmo.46047 > tuner.pandora.com.http: Flags [S], seq 473386744, win 29200, options [mss 1460,sackOK,TS val 53091822 ecr 0,nop,wscale 6], length 0
17:05:15.287585 IP tuner.pandora.com.http > osmo.46047: Flags [S.], seq 275109580, ack 473386745, win 4380, options [mss 1460,nop,wscale 0,nop,nop,TS val 106104800 ecr 53091822,sackOK,eol], length 0
17:05:15.288063 IP osmo.46047 > tuner.pandora.com.http: Flags [.], ack 1, win 457, options [nop,nop,TS val 53091829 ecr 106104800], length 0
17:05:15.290420 IP osmo.46047 > tuner.pandora.com.http: Flags [P.], seq 1:804, ack 1, win 457, options [nop,nop,TS val 53091829 ecr 106104800], length 803
17:05:15.373775 IP tuner.pandora.com.http > osmo.46047: Flags [P.], seq 1:1278, ack 804, win 5183, options [nop,nop,TS val 106104885 ecr 53091829], length 1277
17:05:15.374203 IP osmo.46047 > tuner.pandora.com.http: Flags [.], ack 1278, win 502, options [nop,nop,TS val 53091837 ecr 106104885], length 0
17:05:20.037291 IP osmo.46021 > tuner.pandora.com.http: Flags [FP.], seq 803:1606, ack 927, win 954, options [nop,nop,TS val 53092304 ecr 105532652], length 803

**Comment by glyndon** [comment]
Here's another view, possibly more useful.
Mid-song,... type '+', times out. (17:17:36.319282)
Type '+' again, it responds. (17:18:29.072058)

17:17:36.319282 IP osmo.46047 > tuner.pandora.com.http: Flags [P.], seq 473387548:473388464, ack 275110858, win 502, options [nop,nop,TS val 53165932 ecr 106104885], length 916
17:17:36.587195 IP osmo.46047 > tuner.pandora.com.http: Flags [P.], seq 0:916, ack 1, win 502, options [nop,nop,TS val 53165959 ecr 106104885], length 916
17:17:36.857228 IP osmo.46047 > tuner.pandora.com.http: Flags [P.], seq 0:916, ack 1, win 502, options [nop,nop,TS val 53165986 ecr 106104885], length 916
17:17:37.397193 IP osmo.46047 > tuner.pandora.com.http: Flags [P.], seq 0:916, ack 1, win 502, options [nop,nop,TS val 53166040 ecr 106104885], length 916
17:17:38.477244 IP osmo.46047 > tuner.pandora.com.http: Flags [P.], seq 0:916, ack 1, win 502, options [nop,nop,TS val 53166148 ecr 106104885], length 916
17:17:40.637194 IP osmo.46047 > tuner.pandora.com.http: Flags [P.], seq 0:916, ack 1, win 502, options [nop,nop,TS val 53166364 ecr 106104885], length 916
17:17:44.967232 IP osmo.46047 > tuner.pandora.com.http: Flags [P.], seq 0:916, ack 1, win 502, options [nop,nop,TS val 53166797 ecr 106104885], length 916
17:17:53.637279 IP osmo.46047 > tuner.pandora.com.http: Flags [P.], seq 0:916, ack 1, win 502, options [nop,nop,TS val 53167664 ecr 106104885], length 916
17:18:06.327426 IP osmo.46047 > tuner.pandora.com.http: Flags [F.], seq 916, ack 1, win 502, options [nop,nop,TS val 53168933 ecr 106104885], length 0
17:18:10.957205 IP osmo.46047 > tuner.pandora.com.http: Flags [FP.], seq 0:916, ack 1, win 502, options [nop,nop,TS val 53169396 ecr 106104885], length 916


17:18:29.072058 IP osmo.35135 > tuner.pandora.com.http: Flags [S], seq 81768114, win 29200, options [mss 1460,sackOK,TS val 53171207 ecr 0,nop,wscale 6], length 0
17:18:29.135437 IP tuner.pandora.com.http > osmo.35135: Flags [S.], seq 1654831737, ack 81768115, win 4380, options [mss 1460,nop,wscale 0,nop,nop,TS val 106898647 ecr 53171207,sackOK,eol], length 0
17:18:29.135911 IP osmo.35135 > tuner.pandora.com.http: Flags [.], ack 1, win 457, options [nop,nop,TS val 53171213 ecr 106898647], length 0
17:18:29.137765 IP osmo.35135 > tuner.pandora.com.http: Flags [P.], seq 1:917, ack 1, win 457, options [nop,nop,TS val 53171214 ecr 106898647], length 916
17:18:29.301275 IP tuner.pandora.com.http > osmo.35135: Flags [.], ack 917, win 5296, options [nop,nop,TS val 106898813 ecr 53171214], length 0
17:18:29.398182 IP tuner.pandora.com.http > osmo.35135: Flags [P.], seq 1:793, ack 917, win 5296, options [nop,nop,TS val 106898909 ecr 53171214], length 792
17:18:29.398531 IP osmo.35135 > tuner.pandora.com.http: Flags [.], ack 793, win 481, options [nop,nop,TS val 53171240 ecr 106898909], length 0

**Comment by glyndon** [comment]
... and for grins, I tried wiring (in /etc/hosts) the name tumer.pandora.com to one, and later the other, IP address that they round-robin for that name, to see if the issue was just with one of the two servers or a wacky load-balancer. Nope.
Problem was the same in either case.

**Comment by PromyLOPh** [comment]
I think we can safely say the initial theory was corret. The server’s
FIN is lost somewhere and never reaches your Raspberry Pi. Is there a
NAT router between your box and Pandora?

The patch linked below enables a few pretty aggressive TCP keepalive
settings. Can you give it a try?
https://gist.github.com/09c85257214122e12e90

**Comment by glyndon** [comment]
There are 2 NAT routers between the box and Pandora. One is Comcast's.
I'll try the patch and report back.

**Comment by glyndon** [comment]
There are 2 NAT routers between the box and Pandora. One is Comcast's.

The patch seems to be working well.
In tcpdump I see keepalives that weren't happening before (or never had a chance to).

I hadn't noticed this correlation before, but the day before this problem surfaced the cablemodem had taken a spontaneous 30-minute holiday and then resumed operation. I hadn't thought much of it at the time, but that behaviour is symptomatic of a firmware push by Comcast. I'm going to theorize they changed something in layer 4 that shortened timeouts. It's in NAT mode.

**Comment by PromyLOPh** [comment]
Well, not much we can do about that, right? I added a new item to the
todo list that reads “add request retry logic” – I don’t like enabling
keep-alive by default. But don’t get your hopes up: Items usually stay
there for a *very* long time :(

**Comment by glyndon** [comment]
Understood. 
For the meantime I've got the patch.
Not much I can do about Comcast's modem except put it in bridge mode, which would necessitate some rearchitecture since I'm using its NAT layer to make a DMZ which I'd have to build somewhere else.
If they are pushing new firmware, this may start popping up for other users, too, and now we know why.

**Comment by glyndon** [comment]
FWIW, and just so there's more data in case useful: I tried without keepalives yesterday, problem remains. 
I'd been hoping it was a problem introduced in a Comcast firmware update and that it would eventually be corrected, but apparently not [yet].
